{
  "actions": [
    {
      "description": "Drive the delivery vehicle 10 miles toward the town.",
      "fields": [
        {
          "name": "driver",
          "type": "entity_ref"
        },
        {
          "name": "vehicle",
          "type": "entity_ref"
        }
      ],
      "kind": "drive"
    },
    {
      "description": "Buy fuel for the delivery vehicle at the gas station.",
      "fields": [
        {
          "name": "driver",
          "type": "entity_ref"
        },
        {
          "name": "vehicle",
          "type": "entity_ref"
        },
        {
          "name": "station",
          "type": "entity_ref"
        },
        {
          "name": "amount",
          "type": "number"
        }
      ],
      "kind": "refuel"
    },
    {
      "description": "Record 10 miles of completed delivery-route progress.",
      "fields": [
        {
          "name": "driver",
          "type": "entity_ref"
        },
        {
          "name": "vehicle",
          "type": "entity_ref"
        },
        {
          "name": "route",
          "type": "entity_ref"
        }
      ],
      "kind": "record-route-progress"
    },
    {
      "description": "Request roadside assistance or a tow for a stopped delivery vehicle to an ahead destination.",
      "fields": [
        {
          "name": "driver",
          "type": "entity_ref"
        },
        {
          "name": "vehicle",
          "type": "entity_ref"
        },
        {
          "name": "destination",
          "type": "entity_ref"
        }
      ],
      "kind": "request-roadside-assistance"
    }
  ],
  "components": [
    {
      "fields": [
        {
          "default": 0,
          "name": "road_position",
          "type": "integer"
        },
        {
          "default": "driving",
          "name": "decision_status",
          "type": "string"
        }
      ],
      "name": "driver"
    },
    {
      "fields": [
        {
          "default": 0,
          "name": "road_position",
          "type": "integer"
        },
        {
          "default": 4,
          "name": "fuel",
          "type": "number"
        },
        {
          "default": 16,
          "name": "fuel_tank_capacity",
          "type": "number"
        },
        {
          "default": 0.04,
          "name": "fuel_consumption_rate",
          "type": "number"
        },
        {
          "default": 25,
          "name": "fuel_economy",
          "type": "number"
        },
        {
          "default": "operational",
          "name": "operational_status",
          "type": "string"
        }
      ],
      "name": "vehicle"
    },
    {
      "fields": [
        {
          "default": 0,
          "name": "road_position",
          "type": "integer"
        },
        {
          "default": 0,
          "name": "length",
          "type": "integer"
        },
        {
          "default": 0,
          "name": "distance_remaining",
          "type": "integer"
        },
        {
          "default": 0,
          "name": "fuel_stock",
          "type": "number"
        },
        {
          "default": "open",
          "name": "operational_status",
          "type": "string"
        },
        {
          "default": false,
          "name": "delivery_received",
          "type": "boolean"
        }
      ],
      "name": "place"
    }
  ],
  "entities": [
    {
      "categories": [
        "actor",
        "driver"
      ],
      "components": {
        "driver": {
          "decision_status": "driving",
          "road_position": 0
        }
      },
      "id": "delivery-driver",
      "label": "Delivery driver"
    },
    {
      "categories": [
        "vehicle"
      ],
      "components": {
        "vehicle": {
          "fuel": 4,
          "fuel_consumption_rate": 0.04,
          "fuel_economy": 25,
          "fuel_tank_capacity": 16,
          "operational_status": "operational",
          "road_position": 0
        }
      },
      "id": "delivery-vehicle",
      "label": "Delivery vehicle",
      "owner_ref": "actor:delivery-driver",
      "portable": true
    },
    {
      "categories": [
        "gas station",
        "fuel source"
      ],
      "components": {
        "place": {
          "delivery_received": false,
          "distance_remaining": 0,
          "fuel_stock": 0,
          "length": 0,
          "operational_status": "open",
          "road_position": 60
        }
      },
      "id": "gas-station",
      "label": "Gas station"
    },
    {
      "categories": [
        "town",
        "destination"
      ],
      "components": {
        "place": {
          "delivery_received": false,
          "distance_remaining": 0,
          "fuel_stock": 0,
          "length": 0,
          "operational_status": "open",
          "road_position": 120
        }
      },
      "id": "town",
      "label": "Town"
    },
    {
      "categories": [
        "road",
        "route"
      ],
      "components": {
        "place": {
          "delivery_received": false,
          "distance_remaining": 120,
          "fuel_stock": 0,
          "length": 120,
          "operational_status": "open",
          "road_position": 0
        }
      },
      "id": "delivery-route",
      "label": "Delivery road"
    }
  ],
  "presentation": {
    "assets": {
      "driver": {
        "kind": "emoji",
        "value": "\ud83e\uddd1\u200d\u2708\ufe0f"
      },
      "gas_station": {
        "kind": "emoji",
        "value": "\u26fd"
      },
      "road": {
        "kind": "emoji",
        "value": "\ud83d\udee3\ufe0f"
      },
      "town": {
        "kind": "emoji",
        "value": "\ud83c\udfd9\ufe0f"
      },
      "vehicle": {
        "kind": "emoji",
        "value": "\ud83d\ude9a"
      }
    },
    "category_assets": {
      "driver": "driver",
      "gas station": "gas_station",
      "road": "road",
      "town": "town",
      "vehicle": "vehicle"
    },
    "station_roles": {
      "destination": "goal",
      "fuel source": "source"
    }
  },
  "schema_version": "world-substrate-authoring-bundle/v0",
  "world": {
    "content_version": 1,
    "id": "delivery-trip",
    "label": "Delivery trip",
    "location": "delivery-route",
    "summary": "A delivery driver can transport a delivery from the departure point to the town."
  }
}